index,overall,Date,Year,reviewText,title,brand,Cleaned Reviews,Vader Sentiment,Vader Analysis,Happy,Angry,Surprise,Sad,Fear,emotion
31170,4.0,2013-03-18,2013,I will be buying more of these in the future. Only reason I gave it a 4 star is because some of the blades have some sort of residue or spots on them. It doesn't seems like they are used because they are pretty sharp.,Wilkinson Sword Double Edge Razor Blade Refills for Men - 5 Count,Schick,I will be buying more of these in the future Only reason I gave it a star is because some of the blades have some sort of residue or spots on them It doesn t seems like they are used because they are pretty sharp ,0.2709,Neutral,0.17,0.17,0.0,0.17,0.5,Fear
31171,2.0,2013-03-14,2013,"I don't find these blades any better than all the others I have tried. I think, know, the razor is more important than the blade choice. If the razor can not hold the blade in perfect alignment, laterally and pitch angle, you will not get a good clean shave. The wrong pitch angle is critical or you will get a scraping not a shave.",Wilkinson Sword Double Edge Razor Blade Refills for Men - 5 Count,Schick,I don t find these blades any better than all the others I have tried I think know the razor is more important than the blade choice If the razor can not hold the blade in perfect alignment laterally and pitch angle you will not get a good clean shave The wrong pitch angle is critical or you will get a scraping not a shave ,-0.0954,Neutral,0.14,0.14,0.0,0.57,0.14,Sad
31172,4.0,2013-02-28,2013,"I haven't used a double edge razor in many years until I started again a few weeks ago.  These Wilkinson Sword Double Edge razor blades have given me a better shave than any of the multi-edge razors I have used.  They work great for my skin type and I feel these blades have a good balance between sharpness and smoothness. They are not the sharpest choice but they I prefer smoothness over sharpness since my growth is in multiple directions.  To me, these blades feel smoother than a Feather and sharper than Derby.  Definitely not a beginners blade due to sharpness, however these are great razor blades, try them!",Wilkinson Sword Double Edge Razor Blade Refills for Men - 5 Count,Schick,I haven t used a double edge razor in many years until I started again a few weeks ago These Wilkinson Sword Double Edge razor blades have given me a better shave than any of the multi edge razors I have used They work great for my skin type and I feel these blades have a good balance between sharpness and smoothness They are not the sharpest choice but they I prefer smoothness over sharpness since my growth is in multiple directions To me these blades feel smoother than a Feather and sharper than Derby Definitely not a beginners blade due to sharpness however these are great razor blades try them ,0.9604,Positive,0.2,0.27,0.0,0.2,0.33,Fear
31173,4.0,2013-02-26,2013,"I've used the Wilkinson Sword blades for about three weeks now, and so far they have give me a nice comfortable shave with my safety razor.  The blades are sharp but not too aggressive.  To give you a frame of reference, I shave a two to three times a week.  My beard is average thickness and my skin is a bit sensitive.  So far, this blade suits me well because I'm getting a close shave, but with no irritation or razor burn afterwards.  The only other DE razor blades I've tried are the Derby blades.  I like them also, but the Wilkinson's I feel are a little bit sharper.  Durability is quite good too.  After three weeks, the Wilkinson blade is still quite sharp and will probably last another three to four shaves easily.  The Derby blades got dull much quicker.  As with many shaving products, it's all personal preference.  If you are somewhat new to safety razor shaving, part of the learning process is to find the right blade that suits you.  I'm still in the process myself and will be trying other brands, but I am happy with the Wilkinson's.  These blades are definitely worth a try and they're not that expensive.  Hope this helps someone.  Thanks!",Wilkinson Sword Double Edge Razor Blade Refills for Men - 5 Count,Schick,I ve used the Wilkinson Sword blades for about three weeks now and so far they have give me a nice comfortable shave with my safety razor The blades are sharp but not too aggressive To give you a frame of reference I shave a two to three times a week My beard is average thickness and my skin is a bit sensitive So far this blade suits me well because I m getting a close shave but with no irritation or razor burn afterwards The only other DE razor blades I ve tried are the Derby blades I like them also but the Wilkinson s I feel are a little bit sharper Durability is quite good too After three weeks the Wilkinson blade is still quite sharp and will probably last another three to four shaves easily The Derby blades got dull much quicker As with many shaving products it s all personal preference If you are somewhat new to safety razor shaving part of the learning process is to find the right blade that suits you I m still in the process myself and will be trying other brands but I am happy with the Wilkinson s These blades are definitely worth a try and they re not that expensive Hope this helps someone Thanks ,0.9814,Positive,0.2,0.12,0.04,0.16,0.48,Fear
31174,5.0,2013-02-20,2013,"I have tried several blades for my Merkur Slant razor and the Wilkinson Sword is the best razor for comfort and sharpness.  There are other razors which are a bit sharper, but I find that it is very difficult to avoid from getting ""bit"" from those blades.  I have been shaving with a safety razor for about a year now and would never go back to the expensive multi-blade razors that I used to use.  Safety razors provide a much closer shave for a much cheaper overall cost.",Wilkinson Sword Double Edge Razor Blade Refills for Men - 5 Count,Schick,I have tried several blades for my Merkur Slant razor and the Wilkinson Sword is the best razor for comfort and sharpness There are other razors which are a bit sharper but I find that it is very difficult to avoid from getting bit from those blades I have been shaving with a safety razor for about a year now and would never go back to the expensive multi blade razors that I used to use Safety razors provide a much closer shave for a much cheaper overall cost ,0.5947,Positive,0.0,0.2,0.2,0.2,0.4,Fear
31175,4.0,2013-02-19,2013,i choose this rating because it is better than most of the same type of blade i bought in the store.,Wilkinson Sword Double Edge Razor Blade Refills for Men - 5 Count,Schick,i choose this rating because it is better than most of the same type of blade i bought in the store ,0.4404,Neutral,0.0,0.0,0.0,0.0,1.0,Fear
31176,5.0,2013-02-17,2013,These blades are great.  Just the right sharpness  and price (some blades may be to sharp for a beginner or someone returning to double edge shaving).,Wilkinson Sword Double Edge Razor Blade Refills for Men - 5 Count,Schick,These blades are great Just the right sharpness and price some blades may be to sharp for a beginner or someone returning to double edge shaving ,0.6249,Positive,0.25,0.5,0.0,0.25,0.0,Angry
31177,5.0,2013-02-10,2013,"Great service, delivered as promised on time and everything was done as promised.used this type of blades before so the quality should not at all be a surprise.",Wilkinson Sword Double Edge Razor Blade Refills for Men - 5 Count,Schick,Great service delivered as promised on time and everything was done as promised used this type of blades before so the quality should not at all be a surprise ,0.8271,Positive,0.2,0.0,0.2,0.4,0.2,Sad
31178,5.0,2013-02-09,2013,"After using, the newer types of razors for many years, and useing electric razors for about 30 plus years, I've returned to ""dear old"" Wilkinson blades. Though not as good as I remember them as a youngster, I am now 80 years old, they still give me the best shave I've had in many a year",Wilkinson Sword Double Edge Razor Blade Refills for Men - 5 Count,Schick,After using the newer types of razors for many years and useing electric razors for about plus years I ve returned to dear old Wilkinson blades Though not as good as I remember them as a youngster I am now years old they still give me the best shave I ve had in many a year,0.6591,Positive,0.0,0.0,0.5,0.0,0.5,Surprise
31179,4.0,2013-02-07,2013,"So after a couple weeks and many nicks/cuts, I am getting the hang of this. Thought these were incredibly (dangerously) sharp at first, but now rarely draw blood. I swap blades out every week to keep it comfortable.",Wilkinson Sword Double Edge Razor Blade Refills for Men - 5 Count,Schick,So after a couple weeks and many nicks cuts I am getting the hang of this Thought these were incredibly dangerously sharp at first but now rarely draw blood I swap blades out every week to keep it comfortable ,0.6652,Positive,0.2,0.2,0.0,0.0,0.6,Fear
31180,3.0,2013-01-16,2013,"Every person's face is different.  I have extremely sensitive skin and these seem to agree with me okay, but only last about 2 shaves.",Wilkinson Sword Double Edge Razor Blade Refills for Men - 5 Count,Schick,Every person s face is different I have extremely sensitive skin and these seem to agree with me okay but only last about shaves ,0.296,Neutral,0.0,0.0,0.0,0.0,0.0,Happy
31181,5.0,2013-01-02,2013,WOW.....I'VE GOTTEN 18 SHAVES FROM ONE WILKINSON DOUBLE EDGE BLADE.....IT DEFINITLY EXCEEDED MY EXPECTATIONS......IF CLOSE SHAVES IS WHAT YOUR LOOKING FOR TRY IT YOU WILL LOVE IT.,Wilkinson Sword Double Edge Razor Blade Refills for Men - 5 Count,Schick,WOW I VE GOTTEN SHAVES FROM ONE WILKINSON DOUBLE EDGE BLADE IT DEFINITLY EXCEEDED MY EXPECTATIONS IF CLOSE SHAVES IS WHAT YOUR LOOKING FOR TRY IT YOU WILL LOVE IT ,0.7125,Positive,0.4,0.0,0.2,0.2,0.2,Happy
31182,5.0,2012-12-28,2012,Only use double-edged razor.  Hard to find blades.  Reasonably priced and probably won't need any more for a very long time.,Wilkinson Sword Double Edge Razor Blade Refills for Men - 5 Count,Schick,Only use double edged razor Hard to find blades Reasonably priced and probably won t need any more for a very long time ,-0.1027,Neutral,0.0,0.25,0.0,0.25,0.5,Fear
31183,5.0,2012-11-14,2012,"I am relatively new to the art of wet shaving with a safety razor, but I'm proud to say I have become more adept at using one. The Parker 99R that I own came with some Shark Super Chrome blades which I did not care for very much. After researching different blades online(I'll include one of the links I found to be particularly helpful), the Wilkinson Sword blades became my weapon of choice! They are sharp yet extremely forgiving and the synthetic polymer coating definitely makes for a less irritating shave!

I religiously try to shave every morning so I've never had a beard or any heavy facial hair growth. However my hair seems to grow back quickly so that 5 o' clock shadow always bothered me. The Wilkinson Sword blades gave me a superb shave that reduced what stubble I had into smooth skin. I've also found I can get a close shave with fewer passes and in a shorter amount of time than the Shark Super Chrome blades I had originally used. I have had no nicks or cuts either, which surprised me given how aggressive the blade can be with hair.

I know there are many other types of razor brands out there(I recommend buying a sample pack), but Wilkinson Sword seems to be the perfect match for my needs. If you're lucky enough to have the same experience as I did with these babies then I hope this review helped! Here's that link I promised to those of you who are still unsure:

[...]",Wilkinson Sword Double Edge Razor Blade Refills for Men - 5 Count,Schick,I am relatively new to the art of wet shaving with a safety razor but I m proud to say I have become more adept at using one The Parker R that I own came with some Shark Super Chrome blades which I did not care for very much After researching different blades online I ll include one of the links I found to be particularly helpful the Wilkinson Sword blades became my weapon of choice They are sharp yet extremely forgiving and the synthetic polymer coating definitely makes for a less irritating shave I religiously try to shave every morning so I ve never had a beard or any heavy facial hair growth However my hair seems to grow back quickly so that o clock shadow always bothered me The Wilkinson Sword blades gave me a superb shave that reduced what stubble I had into smooth skin I ve also found I can get a close shave with fewer passes and in a shorter amount of time than the Shark Super Chrome blades I had originally used I have had no nicks or cuts either which surprised me given how aggressive the blade can be with hair I know there are many other types of razor brands out there I recommend buying a sample pack but Wilkinson Sword seems to be the perfect match for my needs If you re lucky enough to have the same experience as I did with these babies then I hope this review helped Here s that link I promised to those of you who are still unsure ,0.99,Positive,0.2,0.17,0.17,0.23,0.23,Sad
31184,5.0,2012-10-31,2012,I started using a Merkur double edge razor last winter with Merkur blades. It is an excellent product and I really liked the blades too. I ordered the Wilkinson Sword blades after reading several of the reviews here on Amazon and I am impressed! These blades are sharp and last a long time if they are properly cared for. I dry my blades after every use and get 1.5 to 2 weeks out of each blade. Great product at a wonderful price.,Wilkinson Sword Double Edge Razor Blade Refills for Men - 5 Count,Schick,I started using a Merkur double edge razor last winter with Merkur blades It is an excellent product and I really liked the blades too I ordered the Wilkinson Sword blades after reading several of the reviews here on Amazon and I am impressed These blades are sharp and last a long time if they are properly cared for I dry my blades after every use and get to weeks out of each blade Great product at a wonderful price ,0.9701,Positive,0.44,0.11,0.11,0.22,0.11,Happy
31185,4.0,2012-10-23,2012,"I introduced my dad to using a safety razor a couple years ago. He tried Wilkinson blades and found them to be sharper and give a cleaner shave than the Merkur blades. I started having problems with the Merkur blades, too--nicks, razor burn, etc. I learned through some research that Wilkinson makes the sharpest blades on the market. So, at dad's suggestion, I tried them again and love them. They cut close to the skin, don't leave nicks (unless I forget to change the blade), and don't leave razor burn. I think I was too inexperienced when I first tried them.

Just for reference, here's my original review from a few years ago: Usually I use Merkur blades, but I saw these available and figured, ""I'm sure they'll be fine."" The blades felt dull; they were flimsy, and a couple of the blades in the pack had grime on them when I opened them. My skin was irritated like never before and I got more small cuts than I had from my safety razor since...well, ever, really. Immediately, I hopped on Amazon and ordered a pack of the Merkur blades.",Wilkinson Sword Double Edge Razor Blade Refills for Men - 5 Count,Schick,I introduced my dad to using a safety razor a couple years ago He tried Wilkinson blades and found them to be sharper and give a cleaner shave than the Merkur blades I started having problems with the Merkur blades too nicks razor burn etc I learned through some research that Wilkinson makes the sharpest blades on the market So at dad s suggestion I tried them again and love them They cut close to the skin don t leave nicks unless I forget to change the blade and don t leave razor burn I think I was too inexperienced when I first tried them Just for reference here s my original review from a few years ago Usually I use Merkur blades but I saw these available and figured I m sure they ll be fine The blades felt dull they were flimsy and a couple of the blades in the pack had grime on them when I opened them My skin was irritated like never before and I got more small cuts than I had from my safety razor since well ever really Immediately I hopped on Amazon and ordered a pack of the Merkur blades ,-0.0694,Neutral,0.17,0.11,0.0,0.33,0.39,Fear
31186,5.0,2012-10-22,2012,These blades provide shaves that equal those of much more expensive brands. I am happy to have found Wilkinson in the market.,Wilkinson Sword Double Edge Razor Blade Refills for Men - 5 Count,Schick,These blades provide shaves that equal those of much more expensive brands I am happy to have found Wilkinson in the market ,0.5719,Positive,0.33,0.0,0.0,0.33,0.33,Happy
31187,5.0,2012-10-09,2012,"I bought these for my son who found them on Amazon and has been using them for a while now.  This is an excellent buy.  Not super expensive blades, but very decent for a great price.  (The platinum coated ones by the same company are a little bit better, says the son).",Wilkinson Sword Double Edge Razor Blade Refills for Men - 5 Count,Schick,I bought these for my son who found them on Amazon and has been using them for a while now This is an excellent buy Not super expensive blades but very decent for a great price The platinum coated ones by the same company are a little bit better says the son ,0.9023,Positive,0.67,0.0,0.33,0.0,0.0,Happy
31188,1.0,2012-09-30,2012,"A pack of these came with my Merkur razor. They are the dullest blades I've ever used. I actually quit mid-shave and put a Feather blade in to finish. Maybe I just got a bad pack, but I'd never buy these. The Feather blades are maybe the sharpest out there. I probably gave them one star too many. Even a bad blade should be good for one shave. The Wilkenson Sword blade I used wasn't good for anything.",Wilkinson Sword Double Edge Razor Blade Refills for Men - 5 Count,Schick,A pack of these came with my Merkur razor They are the dullest blades I ve ever used I actually quit mid shave and put a Feather blade in to finish Maybe I just got a bad pack but I d never buy these The Feather blades are maybe the sharpest out there I probably gave them one star too many Even a bad blade should be good for one shave The Wilkenson Sword blade I used wasn t good for anything ,-0.0387,Neutral,0.0,0.0,0.0,0.33,0.67,Fear
31189,1.0,2012-09-10,2012,"The product details says five cartridges so I figured I would receive five cartridges (twenty five blades) from this company. I got one cartridge (five blades). But this company will get to keep it's $3.41 because I have to pay the return postage which I won't do.

UPDATE: After I wrote the above review I got an e-mail saying someone had made a mistake. The e-mail asked if I wanted them to send me the other four cartridges (the ones that they were suppose to send me in originally in the add). I said of course!!! I received them in less than a week.",Wilkinson Sword Double Edge Razor Blade Refills for Men - 5 Count,Schick,The product details says five cartridges so I figured I would receive five cartridges twenty five blades from this company I got one cartridge five blades But this company will get to keep it s because I have to pay the return postage which I won t do UPDATE After I wrote the above review I got an e mail saying someone had made a mistake The e mail asked if I wanted them to send me the other four cartridges the ones that they were suppose to send me in originally in the add I said of course I received them in less than a week ,-0.6784,Negative,0.0,0.0,0.25,0.25,0.5,Fear
31190,5.0,2012-09-07,2012,My husband has been useing this brand since before we were married...in November 1963.  He has had a hard time finding them and was very happy to find them.  Prompt delivery and exactly right.  Can't ask for more.  Love Amazon!  Thanks.,Wilkinson Sword Double Edge Razor Blade Refills for Men - 5 Count,Schick,My husband has been useing this brand since before we were married in November He has had a hard time finding them and was very happy to find them Prompt delivery and exactly right Can t ask for more Love Amazon Thanks ,0.9263,Positive,0.5,0.25,0.0,0.25,0.0,Happy
31191,5.0,2012-06-21,2012,"I had been using Derby Extras for months, but didn't like them very much. These Wilkinson blades give me a ridiculously smooth shave, NO (let me repeat NO) tug and pull or razor burn, and their company logo has swords on it. If you're on the fence about getting these, climb over it and buy.",Wilkinson Sword Double Edge Razor Blade Refills for Men - 5 Count,Schick,I had been using Derby Extras for months but didn t like them very much These Wilkinson blades give me a ridiculously smooth shave NO let me repeat NO tug and pull or razor burn and their company logo has swords on it If you re on the fence about getting these climb over it and buy ,-0.8646,Negative,0.0,0.0,0.33,0.33,0.33,Surprise
31192,4.0,2012-06-21,2012,It is pretty sharp and smooth. But it loses its edge faster than I had hoped. Get abt 3 to 4 great shaves and 2 get along shaves per edge and shave once in 3 days. So this pack should last me a long long time.,Wilkinson Sword Double Edge Razor Blade Refills for Men - 5 Count,Schick,It is pretty sharp and smooth But it loses its edge faster than I had hoped Get abt to great shaves and get along shaves per edge and shave once in days So this pack should last me a long long time ,0.8481,Positive,0.33,0.11,0.0,0.33,0.22,Happy
31193,3.0,2012-05-27,2012,"As with all razor blades, they perform differently for different people. These do OK for me, but Feather blades do better. Other people might get different results, therefore my advise: Get a 10 pack of multiple brands and try them out and stick with what works for you",Wilkinson Sword Double Edge Razor Blade Refills for Men - 5 Count,Schick,As with all razor blades they perform differently for different people These do OK for me but Feather blades do better Other people might get different results therefore my advise Get a pack of multiple brands and try them out and stick with what works for you,0.7019,Positive,0.0,0.0,0.0,0.25,0.75,Fear
31194,5.0,2012-04-12,2012,"My husband uses his grandfathers old double edge razor.  With the price of disposable and cartridge blades this is the way to go, so inexpensive! Plus he gets a nice close shave and it is better for the environment.",Wilkinson Sword Double Edge Razor Blade Refills for Men - 5 Count,Schick,My husband uses his grandfathers old double edge razor With the price of disposable and cartridge blades this is the way to go so inexpensive Plus he gets a nice close shave and it is better for the environment ,0.7177,Positive,0.5,0.0,0.0,0.25,0.25,Happy
31195,5.0,2012-01-18,2012,"I used these blades while in England and loved them.  Finally ran out, and ordered here. Interestingly they are a British brand, but these are made in Germany and come in a black container.  The German engineering shows!  Wonderful smooth shave, and I'm getting 8 plus uses out of each one.  Look no further safety razor fans!",Wilkinson Sword Double Edge Razor Blade Refills for Men - 5 Count,Schick,I used these blades while in England and loved them Finally ran out and ordered here Interestingly they are a British brand but these are made in Germany and come in a black container The German engineering shows Wonderful smooth shave and I m getting plus uses out of each one Look no further safety razor fans ,0.8964,Positive,0.14,0.0,0.14,0.29,0.43,Fear
31196,5.0,2011-08-14,2011,Love these blades. I tried a few brands when switching to a safety razor and these gave me the closest shave with the least irritation. Your results may vary.,Wilkinson Sword Double Edge Razor Blade Refills for Men - 5 Count,Schick,Love these blades I tried a few brands when switching to a safety razor and these gave me the closest shave with the least irritation Your results may vary ,0.8658,Positive,0.25,0.0,0.0,0.25,0.5,Fear
31197,1.0,2011-04-05,2011,"This is not a review for the wilkinson blades themselves, which are awesome (5 stars). I selected to purchase 100 blades for $18.95. The title above said 50ct. If I had received 50 I would have been ok with it (cost a bit higher than local, but saved me a trip to the store); however, I received 10 blades for $14.54. They sell locally for around $1.25 for a 5 pack. Two dollars fifty is no where near $14.54 and since it isn't what I signed up for, Kay Beauty: I will absolutely be returning these.",Wilkinson Sword Double Edge Razor Blade Refills for Men - 5 Count,Schick,This is not a review for the wilkinson blades themselves which are awesome stars I selected to purchase blades for The title above said ct If I had received I would have been ok with it cost a bit higher than local but saved me a trip to the store however I received blades for They sell locally for around for a pack Two dollars fifty is no where near and since it isn t what I signed up for Kay Beauty I will absolutely be returning these ,0.882,Positive,0.11,0.0,0.44,0.0,0.44,Surprise
31198,1.0,2011-03-17,2011,"I think the wording is deceiving, saying 5 cartriges instead of saying 5 blades gives a buyer the incorrect impression.  I would not have bought that product if I had known I was  getting only 5 blades for that price.",Wilkinson Sword Double Edge Razor Blade Refills for Men - 5 Count,Schick,I think the wording is deceiving saying cartriges instead of saying blades gives a buyer the incorrect impression I would not have bought that product if I had known I was getting only blades for that price ,-0.128,Neutral,0.0,0.33,0.0,0.33,0.33,Angry
31199,1.0,2011-02-15,2011,"Whew!  These things shred my face to pieces!  Small price, but still a waste of my mula.  :-(",Wilkinson Sword Double Edge Razor Blade Refills for Men - 5 Count,Schick,Whew These things shred my face to pieces Small price but still a waste of my mula ,-0.8193,Negative,0.0,0.0,1.0,0.0,0.0,Surprise
