index,overall,Date,Year,reviewText,title,brand,Cleaned Reviews,Vader Sentiment,Vader Analysis,Happy,Angry,Surprise,Sad,Fear,emotion
31376,5.0,2013-04-05,2013,"I use this bubble bath in the late fall and throughout the winter.  The bubbles last for a long time, and it seems as if this product helps ""melt away"" the cold winter blues.","Badedas Classic Vital Bad Bubble Bath, 25.5 Fluid Ounce",Badedas,I use this bubble bath in the late fall and throughout the winter The bubbles last for a long time and it seems as if this product helps melt away the cold winter blues ,0.3818,Neutral,0.0,0.14,0.29,0.29,0.29,Surprise
31377,5.0,2013-03-28,2013,Terrific pine fragrance - a little goes a long way - always fun when the green glop turns to chartreuse when water is added.,"Badedas Classic Vital Bad Bubble Bath, 25.5 Fluid Ounce",Badedas,Terrific pine fragrance a little goes a long way always fun when the green glop turns to chartreuse when water is added ,0.7506,Positive,0.14,0.0,0.29,0.43,0.14,Sad
31378,4.0,2013-03-21,2013,"Nice and special product for bubble baths, with a longlasting solution. . . . . . . . . .","Badedas Classic Vital Bad Bubble Bath, 25.5 Fluid Ounce",Badedas,Nice and special product for bubble baths with a longlasting solution ,0.7783,Positive,0.33,0.0,0.33,0.0,0.33,Happy
31379,5.0,2013-03-12,2013,"Nothing compares to this product.  Its aroma endures hours and hours and you feel renewed, just like a new born baby.","Badedas Classic Vital Bad Bubble Bath, 25.5 Fluid Ounce",Badedas,Nothing compares to this product Its aroma endures hours and hours and you feel renewed just like a new born baby ,0.3612,Neutral,0.0,0.0,0.0,1.0,0.0,Sad
31380,4.0,2013-02-28,2013,"Good bubble action, looks toxic green in tub (the Grinch would love it) but rinses right out. Has a really strong smell (clean, almost pine-like but not ""cleaning product"" clean) and doesn't dry out my skin","Badedas Classic Vital Bad Bubble Bath, 25.5 Fluid Ounce",Badedas,Good bubble action looks toxic green in tub the Grinch would love it but rinses right out Has a really strong smell clean almost pine like but not cleaning product clean and doesn t dry out my skin,0.8569,Positive,0.4,0.0,0.0,0.2,0.4,Happy
31381,5.0,2013-02-27,2013,"I first learned of badedas many, many years ago from my Wife's relatives living in Bermuda before it was available in the United States. They would bring it over as a gift for my Wife and In-Laws when visiting. It is, and always has been my Wife's favorite bath product!! Perfect for those ""At Home"" ""Treat Yourself"" kind of days where you ladies can relax, forget about your worries and enjoy a moment of bliss!!  For You Men,,, if you buy this product for your special lady be advised she will let you know BEFORE shes need another bottle!! You'll love the long lasting after sent it leaves on her body!!","Badedas Classic Vital Bad Bubble Bath, 25.5 Fluid Ounce",Badedas,I first learned of badedas many many years ago from my Wife s relatives living in Bermuda before it was available in the United States They would bring it over as a gift for my Wife and In Laws when visiting It is and always has been my Wife s favorite bath product Perfect for those At Home Treat Yourself kind of days where you ladies can relax forget about your worries and enjoy a moment of bliss For You Men if you buy this product for your special lady be advised she will let you know BEFORE shes need another bottle You ll love the long lasting after sent it leaves on her body ,0.9822,Positive,0.26,0.05,0.16,0.32,0.21,Sad
31382,5.0,2013-02-23,2013,"I can understand how this would be one of those scents that some people will really like and others will (just as passionately) dislike; honestly, you really just have to try it and see. If you've never used it before, and you are considering it, then I highly encourage you to go ahead because I took a chance and this is a 'lil slice of heaven in the bathtub...in my opinion. It definitely smells green to me, but not in a piney or astringent sort of way, more like early spring forest after a rain. Nothing floral, just clean fresh intoxicating green. Also, aside from whatever remarkable stuff they are putting in there to make it smell so sublime, it also makes my skin incredibly soft. Very soft. It's quite wonderful really.","Badedas Classic Vital Bad Bubble Bath, 25.5 Fluid Ounce",Badedas,I can understand how this would be one of those scents that some people will really like and others will just as passionately dislike honestly you really just have to try it and see If you ve never used it before and you are considering it then I highly encourage you to go ahead because I took a chance and this is a lil slice of heaven in the bathtub in my opinion It definitely smells green to me but not in a piney or astringent sort of way more like early spring forest after a rain Nothing floral just clean fresh intoxicating green Also aside from whatever remarkable stuff they are putting in there to make it smell so sublime it also makes my skin incredibly soft Very soft It s quite wonderful really ,0.972,Positive,0.13,0.07,0.2,0.27,0.33,Fear
31383,5.0,2013-02-19,2013,exact item I buy in Europe at a fair price. I will use this sign to purchase this item again.,"Badedas Classic Vital Bad Bubble Bath, 25.5 Fluid Ounce",Badedas,exact item I buy in Europe at a fair price I will use this sign to purchase this item again ,0.3182,Neutral,0.0,0.0,0.0,0.0,1.0,Fear
31384,5.0,2013-02-19,2013,The original is still the very best!  First purchased in 1975 in Madrid Spain. Recommended highly for the clean fresh after shower odor that lingers.,"Badedas Classic Vital Bad Bubble Bath, 25.5 Fluid Ounce",Badedas,The original is still the very best First purchased in in Madrid Spain Recommended highly for the clean fresh after shower odor that lingers ,0.9209,Positive,0.0,0.0,0.0,0.0,1.0,Fear
31385,5.0,2013-02-13,2013,"Overpriced, but the heart wants what the heart wants.  Got addicted this in Germany.  My family loves this stuff.  Luxury.","Badedas Classic Vital Bad Bubble Bath, 25.5 Fluid Ounce",Badedas,Overpriced but the heart wants what the heart wants Got addicted this in Germany My family loves this stuff Luxury ,0.7227,Positive,0.2,0.2,0.2,0.4,0.0,Sad
31386,5.0,2013-02-11,2013,"My husband visited Germany and brought this back for me. I used it all up and really missed the fresh smell and calming effect. The smell is not too fruity or perfumey, but very clean smelling.  I was super excited to find this product on Amazon.  The bottle is really big and all you need is a small amount in a bath tub, so it really lasts.  If you are a bubble bath junkie, like myself, you have to invest in this bubble bath.  There's nothing quite like it!","Badedas Classic Vital Bad Bubble Bath, 25.5 Fluid Ounce",Badedas,My husband visited Germany and brought this back for me I used it all up and really missed the fresh smell and calming effect The smell is not too fruity or perfumey but very clean smelling I was super excited to find this product on Amazon The bottle is really big and all you need is a small amount in a bath tub so it really lasts If you are a bubble bath junkie like myself you have to invest in this bubble bath There s nothing quite like it ,0.9725,Positive,0.12,0.0,0.12,0.38,0.38,Sad
31387,5.0,2013-02-04,2013,"Out of all the bubble bath type products you can buy, Badedas is top rated. I've used it for the past 5 yrs now. It's been a family tradition for my Mum and Aunty to use it, and it's just one of those fresh pine smelling baths, that make you want to curl up after and drift off to sleep. 2 caps under running water, soak for at least 10 mins, and you're good! It's a huge bottle as well, so it lasts. I do use other kinds of bubbles,Bath and Body have left me dry skinned, and the bubbles don't last. I always come back to this one. I hope my review helped you.","Badedas Classic Vital Bad Bubble Bath, 25.5 Fluid Ounce",Badedas,Out of all the bubble bath type products you can buy Badedas is top rated I ve used it for the past yrs now It s been a family tradition for my Mum and Aunty to use it and it s just one of those fresh pine smelling baths that make you want to curl up after and drift off to sleep caps under running water soak for at least mins and you re good It s a huge bottle as well so it lasts I do use other kinds of bubbles Bath and Body have left me dry skinned and the bubbles don t last I always come back to this one I hope my review helped you ,0.9168,Positive,0.08,0.0,0.38,0.31,0.23,Surprise
31388,5.0,2013-02-03,2013,"This has a fresh,clean somewhat pine like smell in my opinion.  It does not take a lot of this product to make a bubble bath or just lathering up.","Badedas Classic Vital Bad Bubble Bath, 25.5 Fluid Ounce",Badedas,This has a fresh clean somewhat pine like smell in my opinion It does not take a lot of this product to make a bubble bath or just lathering up ,0.3008,Neutral,0.0,0.0,0.0,0.75,0.25,Sad
31389,5.0,2013-01-31,2013,It's wonderful i have used it on and off for over 20 years.  I am glad i could get it from you.,"Badedas Classic Vital Bad Bubble Bath, 25.5 Fluid Ounce",Badedas,It s wonderful i have used it on and off for over years I am glad i could get it from you ,0.7717,Positive,0.5,0.0,0.5,0.0,0.0,Happy
31390,5.0,2013-01-23,2013,"This is almost ""magical"" in joint and pain relief. It kind of turns you into mush! When I can't sleep? THIS is what I use...the fragrance is liked by some and not liked by some. It's ""personal"". It IS a different smell. FANTASTIC bubbles!!","Badedas Classic Vital Bad Bubble Bath, 25.5 Fluid Ounce",Badedas,This is almost magical in joint and pain relief It kind of turns you into mush When I can t sleep THIS is what I use the fragrance is liked by some and not liked by some It s personal It IS a different smell FANTASTIC bubbles ,0.8912,Positive,0.33,0.0,0.17,0.0,0.5,Fear
31391,5.0,2013-01-18,2013,"This product I have used for many years perfect  Shower Gel. No grease or residue left in your shower, wonderful fragrance and a perfect clean feeling.!!!","Badedas Classic Vital Bad Bubble Bath, 25.5 Fluid Ounce",Badedas,This product I have used for many years perfect Shower Gel No grease or residue left in your shower wonderful fragrance and a perfect clean feeling ,0.9257,Positive,0.0,0.0,0.25,0.5,0.25,Sad
31392,5.0,2013-01-11,2013,It's a great way to have a bubble bath.  I feel like I'm in a forest with the pine smell.,"Badedas Classic Vital Bad Bubble Bath, 25.5 Fluid Ounce",Badedas,It s a great way to have a bubble bath I feel like I m in a forest with the pine smell ,0.765,Positive,0.33,0.0,0.0,0.33,0.33,Happy
31393,5.0,2013-01-04,2013,"Since I have been using this product, my bath time has become a luxury experience.  Light a candle and incense, pour yourself a glass of wine, and luxuriate!","Badedas Classic Vital Bad Bubble Bath, 25.5 Fluid Ounce",Badedas,Since I have been using this product my bath time has become a luxury experience Light a candle and incense pour yourself a glass of wine and luxuriate ,0.0,Neutral,0.0,1.0,0.0,0.0,0.0,Angry
31394,5.0,2012-12-25,2012,"It's very bubbly and the bubbles stay for a long time.  Very pleasantly fragrant and relaxing, I wouldn't describe it as woodsy, but it does have a natural and clean type of smell.  My boyfriend doesn't like scents and cologne, but he's totally fine with it.  It does turn the water into a bright yellow/green color.","Badedas Classic Vital Bad Bubble Bath, 25.5 Fluid Ounce",Badedas,It s very bubbly and the bubbles stay for a long time Very pleasantly fragrant and relaxing I wouldn t describe it as woodsy but it does have a natural and clean type of smell My boyfriend doesn t like scents and cologne but he s totally fine with it It does turn the water into a bright yellow green color ,0.9315,Positive,0.18,0.09,0.09,0.18,0.45,Fear
31395,5.0,2012-12-25,2012,"This is the stuff....world's best shower gel.  Nothing like it made in the USA.  It's a common product in Germany, but nothing like it in U.S.","Badedas Classic Vital Bad Bubble Bath, 25.5 Fluid Ounce",Badedas,This is the stuff world s best shower gel Nothing like it made in the USA It s a common product in Germany but nothing like it in U S ,-0.1581,Neutral,0.0,0.33,0.0,0.33,0.33,Angry
31396,5.0,2012-12-18,2012,"Have not seen the product for some time, but when I get into a bath with BADEDAS the bubbles and scent soothe away all my cares!!!  Highly recommended to ease tension!!!  The smell goes through the whole house and my family love it!","Badedas Classic Vital Bad Bubble Bath, 25.5 Fluid Ounce",Badedas,Have not seen the product for some time but when I get into a bath with BADEDAS the bubbles and scent soothe away all my cares Highly recommended to ease tension The smell goes through the whole house and my family love it ,0.9615,Positive,0.17,0.17,0.17,0.17,0.33,Fear
31397,5.0,2012-12-18,2012,"Still the same great product we came to know and love while stationed in Germany.
We often recommend to friends...","Badedas Classic Vital Bad Bubble Bath, 25.5 Fluid Ounce",Badedas,Still the same great product we came to know and love while stationed in Germany We often recommend to friends ,0.8957,Positive,1.0,0.0,0.0,0.0,0.0,Happy
31398,5.0,2012-12-18,2012,"I have been using Vitabath for many years. It has always been a wonderful product. But, now it is so difficult to find, and they have introduced a new line of scents into the line that I don't care for. I also have a suspicion that Spring Green has been
reformulated. I'm not sure-but it just doesn't seem to be the same to me. I have read many reviews about Badedas, so I decided to try it.
I'm so glad I did. It was very similar to Vitabath, but reminded me of what Spring Green used to be. This is  a quality product, and makes for a very nice spa like experience.","Badedas Classic Vital Bad Bubble Bath, 25.5 Fluid Ounce",Badedas,I have been using Vitabath for many years It has always been a wonderful product But now it is so difficult to find and they have introduced a new line of scents into the line that I don t care for I also have a suspicion that Spring Green has been reformulated I m not sure but it just doesn t seem to be the same to me I have read many reviews about Badedas so I decided to try it I m so glad I did It was very similar to Vitabath but reminded me of what Spring Green used to be This is a quality product and makes for a very nice spa like experience ,0.6405,Positive,0.2,0.0,0.3,0.1,0.4,Fear
31399,5.0,2012-12-16,2012,"Great product;have been using for years and your price and service are exceptional
Will be returning and have recommended to friends","Badedas Classic Vital Bad Bubble Bath, 25.5 Fluid Ounce",Badedas,Great product have been using for years and your price and service are exceptional Will be returning and have recommended to friends,0.8402,Positive,1.0,0.0,0.0,0.0,0.0,Happy
31400,5.0,2012-12-12,2012,"Spicy world of USA, Inc badedas classic vital bad bubblr bath. very good in a bath and shower. lasts about a month. twenrty ounces plus Mrs Gayle Baring","Badedas Classic Vital Bad Bubble Bath, 25.5 Fluid Ounce",Badedas,Spicy world of USA Inc badedas classic vital bad bubblr bath very good in a bath and shower lasts about a month twenrty ounces plus Mrs Gayle Baring,0.2247,Neutral,0.0,0.0,0.0,0.0,0.0,Happy
31401,2.0,2012-12-10,2012,"I bought this one because I was fooled by the ""classic"" written on the bottle and the ""made in Germany"". If you are used to the wonderful smell of Badedas, you'll find this formula much messed with! The maker is now ""Unilever"". I have a bottle I bought in the UK (also made in the UK) which smells like the true ""classic"" one, but it doesn't advertise it on the bottle. I compared the two formulas and they are different. This one smells different, as if it were made with cheaper ingredients. That characteristic strong pine-horse chestnut smell is gone. Even the colour has been messed with. It dilutes into a cheap, artificial, almost urinous yellowish-green that makes you want to run away from the bathtub.","Badedas Classic Vital Bad Bubble Bath, 25.5 Fluid Ounce",Badedas,I bought this one because I was fooled by the classic written on the bottle and the made in Germany If you are used to the wonderful smell of Badedas you ll find this formula much messed with The maker is now Unilever I have a bottle I bought in the UK also made in the UK which smells like the true classic one but it doesn t advertise it on the bottle I compared the two formulas and they are different This one smells different as if it were made with cheaper ingredients That characteristic strong pine horse chestnut smell is gone Even the colour has been messed with It dilutes into a cheap artificial almost urinous yellowish green that makes you want to run away from the bathtub ,0.68,Positive,0.07,0.27,0.07,0.33,0.27,Sad
31402,5.0,2012-12-10,2012,"I have been using this soap since I was a little girl in Germany.
It smells refreshing, clean, and green!
Leaves you moisturized, not squeaky, keeps your jewelry shiny, and has a pleasant texture to use.
I do recommend dispensing it into another container that squirts easily into your hand... the widemouth bottle can lead to overly generous dollops of soap!
:)","Badedas Classic Vital Bad Bubble Bath, 25.5 Fluid Ounce",Badedas,I have been using this soap since I was a little girl in Germany It smells refreshing clean and green Leaves you moisturized not squeaky keeps your jewelry shiny and has a pleasant texture to use I do recommend dispensing it into another container that squirts easily into your hand the widemouth bottle can lead to overly generous dollops of soap ,0.95,Positive,0.4,0.0,0.2,0.0,0.4,Happy
31403,5.0,2012-12-06,2012,"Back in 1970, our family went to Germany for my dad's work.  In our hotel room, they had Badedas packets for the customers.  Over the years, I would remember that first experience upon our arrival in Germany.  I never forgot this product....the smell, the bubbles, what a great experience after a long day of traveling.  Out of the blue I decided to do a search for the product on-line; to my delight, I found it.  It is everything I remembered it to be and I have loved being reacquainted with it.  I feel sure I won't be without it ever again.","Badedas Classic Vital Bad Bubble Bath, 25.5 Fluid Ounce",Badedas,Back in our family went to Germany for my dad s work In our hotel room they had Badedas packets for the customers Over the years I would remember that first experience upon our arrival in Germany I never forgot this product the smell the bubbles what a great experience after a long day of traveling Out of the blue I decided to do a search for the product on line to my delight I found it It is everything I remembered it to be and I have loved being reacquainted with it I feel sure I won t be without it ever again ,0.9349,Positive,0.29,0.07,0.07,0.07,0.5,Fear
31404,5.0,2012-11-26,2012,I have used this product for many years.  A soaking in its suds is both refreshing and relaxing and I have not found its equal with any other bubble bath.,"Badedas Classic Vital Bad Bubble Bath, 25.5 Fluid Ounce",Badedas,I have used this product for many years A soaking in its suds is both refreshing and relaxing and I have not found its equal with any other bubble bath ,0.4939,Neutral,0.0,0.0,0.0,0.0,1.0,Fear
31405,5.0,2012-11-22,2012,"Silky bubbles, fresh clean scent - Badedas Classic is fantastic. There is no fake fruity or floral stink to it. Good for men and women. I only use a small amount for a garden tub - so a 25.5oz bottle should last you quite some time so I think the price is fair. I order this on Subscribe & Save.","Badedas Classic Vital Bad Bubble Bath, 25.5 Fluid Ounce",Badedas,Silky bubbles fresh clean scent Badedas Classic is fantastic There is no fake fruity or floral stink to it Good for men and women I only use a small amount for a garden tub so a oz bottle should last you quite some time so I think the price is fair I order this on Subscribe Save ,0.8402,Positive,0.33,0.0,0.0,0.67,0.0,Sad
31406,2.0,2012-11-16,2012,"I purchased Badedas because I have loved Vitabath for many years and was assured that Badedas was virtually identical. As it costs signifcantly less, and there have been complaints about the quality of recent purchases of Vitabath, I thought it was worth a try. While both are thick green bath gels, the smell is very different.  Vitabath has a light, clean, refreshing scent while Badedas has strong musky undertones that I can only describe as smelling like a combination of stale sweat and cheap perfume. I do realize what smells good or bad can be highly subjective, and many truly seem to like the scent of Badedas but it definitely does NOT smell like Vitabath  and if you purchase it as a substitute you will most likely be disappointed. I find the smell unpleasant enough to render my purchase useless.  (My husband concurs, so it's not just me!)","Badedas Classic Vital Bad Bubble Bath, 25.5 Fluid Ounce",Badedas,I purchased Badedas because I have loved Vitabath for many years and was assured that Badedas was virtually identical As it costs signifcantly less and there have been complaints about the quality of recent purchases of Vitabath I thought it was worth a try While both are thick green bath gels the smell is very different Vitabath has a light clean refreshing scent while Badedas has strong musky undertones that I can only describe as smelling like a combination of stale sweat and cheap perfume I do realize what smells good or bad can be highly subjective and many truly seem to like the scent of Badedas but it definitely does NOT smell like Vitabath and if you purchase it as a substitute you will most likely be disappointed I find the smell unpleasant enough to render my purchase useless My husband concurs so it s not just me ,0.3912,Neutral,0.1,0.0,0.1,0.14,0.67,Fear
31407,5.0,2012-11-12,2012,This is the very best bubble bath in the world. :) The whole house smells delightful with this in the tub. There are two styles of bottle available and I wish this was the smooth style..The smooth style is so much more attractive.. This ridged version is a little 70's style.. but.. I had an empty one in the other style and so I just transferred the contents. Best of both worlds.  Another advantage of the smooth style is that it has a pin hole dispenser which is very efficient. You only need a tablespoon or so for a good amount of bubbles.. I found that most bubble baths dry out my hair and don't do my skin any favors but Badedas doesn't affect my hair at all and it's great for my skin.. You can not smell one chemical from this lovely mixture of botanicals. :),"Badedas Classic Vital Bad Bubble Bath, 25.5 Fluid Ounce",Badedas,This is the very best bubble bath in the world The whole house smells delightful with this in the tub There are two styles of bottle available and I wish this was the smooth style The smooth style is so much more attractive This ridged version is a little s style but I had an empty one in the other style and so I just transferred the contents Best of both worlds Another advantage of the smooth style is that it has a pin hole dispenser which is very efficient You only need a tablespoon or so for a good amount of bubbles I found that most bubble baths dry out my hair and don t do my skin any favors but Badedas doesn t affect my hair at all and it s great for my skin You can not smell one chemical from this lovely mixture of botanicals ,0.9852,Positive,0.46,0.0,0.15,0.15,0.23,Happy
31408,5.0,2012-11-11,2012,Love this bubble bath the bath is soo soothing and relaxing and the smell is like you r taken away to a outdoor spa in the nutty pine forest. The aroma is awesome. I guess if u r not much for the out doors u may not experence the same. I have it on auto ship. Ty Amazon for carrying this awesome product.,"Badedas Classic Vital Bad Bubble Bath, 25.5 Fluid Ounce",Badedas,Love this bubble bath the bath is soo soothing and relaxing and the smell is like you r taken away to a outdoor spa in the nutty pine forest The aroma is awesome I guess if u r not much for the out doors u may not experence the same I have it on auto ship Ty Amazon for carrying this awesome product ,0.9741,Positive,0.12,0.12,0.38,0.12,0.25,Surprise
31409,5.0,2012-11-08,2012,"It is a pity that this delicious gel is no more available in many countries (Spain is one of them) and has been substituted by a bad copy (Badedas ""Original"")
Good things tend to disappear!.","Badedas Classic Vital Bad Bubble Bath, 25.5 Fluid Ounce",Badedas,It is a pity that this delicious gel is no more available in many countries Spain is one of them and has been substituted by a bad copy Badedas Original Good things tend to disappear ,-0.1511,Neutral,0.0,0.0,0.5,0.5,0.0,Surprise
31410,5.0,2012-10-20,2012,Shipping is outrageous but the product is the original badedas from Germany and induces a deep relaxing sleep if taking a bath before bedtime. Scent is strong but pleasant.,"Badedas Classic Vital Bad Bubble Bath, 25.5 Fluid Ounce",Badedas,Shipping is outrageous but the product is the original badedas from Germany and induces a deep relaxing sleep if taking a bath before bedtime Scent is strong but pleasant ,0.9446,Positive,0.4,0.0,0.4,0.0,0.2,Happy
31411,5.0,2012-10-06,2012,"The original Badedas shower gel was perfect - although this is a bubble bath, it is similar, and has the same scent, which was my favorite.","Badedas Classic Vital Bad Bubble Bath, 25.5 Fluid Ounce",Badedas,The original Badedas shower gel was perfect although this is a bubble bath it is similar and has the same scent which was my favorite ,0.8402,Positive,0.5,0.0,0.0,0.5,0.0,Happy
