index,overall,Date,Year,reviewText,title,brand,Cleaned Reviews,Vader Sentiment,Vader Analysis,Happy,Angry,Surprise,Sad,Fear,emotion
0,5.0,2016-03-10,2016,Excellent very good,Lacto Calamine Skin Balance Oil control 120 ml. (Pack of 2),Pirmal Healthcare,Excellent very good,0.7841,Positive,1.0,0.0,0.0,0.0,0.0,Happy
2,5.0,2014-10-03,2014,Magical,Lacto Calamine Skin Balance Oil control 120 ml. (Pack of 2),Pirmal Healthcare,Magical,0.0,Neutral,0.0,0.0,0.0,0.0,0.0,Happy
4,4.0,2014-06-14,2014,I do like the product a lot...I had bought them from India and they cost about $3/4 there...but since its not so easily available here I had to look for them in Amazon... they charged me more than double here.,Lacto Calamine Skin Balance Oil control 120 ml. (Pack of 2),Pirmal Healthcare,I do like the product a lot I had bought them from India and they cost about there but since its not so easily available here I had to look for them in Amazon they charged me more than double here ,-0.2182,Neutral,0.25,0.0,0.25,0.25,0.25,Happy
5,5.0,2018-03-02,2018,I have OILY skin. I have tried quite a few mattifying moisturizers and I am so happy I found this. Make sure you shake it well. It absorbs quite well also.,Lacto Calamine Skin Balance Oil control 120 ml. (Pack of 2),Pirmal Healthcare,I have OILY skin I have tried quite a few mattifying moisturizers and I am so happy I found this Make sure you shake it well It absorbs quite well also ,0.8605,Positive,0.33,0.0,0.33,0.33,0.0,Happy
6,1.0,2017-10-05,2017,Got different bottle looks dulpicate,Lacto Calamine Skin Balance Oil control 120 ml. (Pack of 2),Pirmal Healthcare,Got different bottle looks dulpicate,0.0,Neutral,0.0,0.0,0.0,0.0,0.0,Happy
7,5.0,2017-09-09,2017,I like this one then green one I don't know why. Green is also good but I prefer this for my skin. I am been using this for 2 years now and I love it. It balances my oily skin.,Lacto Calamine Skin Balance Oil control 120 ml. (Pack of 2),Pirmal Healthcare,I like this one then green one I don t know why Green is also good but I prefer this for my skin I am been using this for years now and I love it It balances my oily skin ,0.8591,Positive,0.67,0.0,0.0,0.0,0.33,Happy
8,4.0,2017-04-12,2017,Product delivered was different flavour instead of basic lactoclamine.,Lacto Calamine Skin Balance Oil control 120 ml. (Pack of 2),Pirmal Healthcare,Product delivered was different flavour instead of basic lactoclamine ,0.0,Neutral,0.0,0.0,0.0,0.0,1.0,Fear
9,5.0,2017-04-07,2017,my favorite beauty product,Lacto Calamine Skin Balance Oil control 120 ml. (Pack of 2),Pirmal Healthcare,my favorite beauty product,0.7783,Positive,1.0,0.0,0.0,0.0,0.0,Happy
10,3.0,2017-01-26,2017,"The liquid separates into a creamy mass and clear liquid. Needs vigorous shaking to blend it together. Otherwise, a great product.",Lacto Calamine Skin Balance Oil control 120 ml. (Pack of 2),Pirmal Healthcare,The liquid separates into a creamy mass and clear liquid Needs vigorous shaking to blend it together Otherwise a great product ,0.7184,Positive,0.5,0.0,0.0,0.5,0.0,Happy
11,4.0,2017-01-07,2017,Delivery took long time. Just started to use it. It should work based on previous usage.,Lacto Calamine Skin Balance Oil control 120 ml. (Pack of 2),Pirmal Healthcare,Delivery took long time Just started to use it It should work based on previous usage ,0.0,Neutral,0.0,0.0,0.0,0.33,0.67,Fear
12,5.0,2016-10-16,2016,"I buy this for my mom, 77 year old. She has beautiful skin and she has been using this for many years.",Lacto Calamine Skin Balance Oil control 120 ml. (Pack of 2),Pirmal Healthcare,I buy this for my mom year old She has beautiful skin and she has been using this for many years ,0.5994,Positive,1.0,0.0,0.0,0.0,0.0,Happy
13,5.0,2016-10-03,2016,"I have combination skin, which means my forehead, chin, and top of nose region gets extremely oily and the nostril and cheek region gets extremely dry. I have tried a variety of skin care products and this is the only one that can balance the oils on my face. It helps heal breakouts and prevent new ones; and is the only product that helps with my acne. This product is also great for mild to severe sunburns; apply generously to affected area and you will feel the cooling effect immediately. Regular application(twice/ thrice a day) to sunburnt area helps heal the burn and peeling skin. The ingredients separate easily because it is a combination of clays and glycerin, so make sure you shake the bottle well before each use to ensure smooth application.

The product is good for 5 years from the date at the bottom of the bottle (date of manufacturing) . E.g., if the date is Aug 16 (2016), then your bottle of the lotion is good until Aug 21(2021).

I have been using this for years and would definitely recommend it to people with all skin types.",Lacto Calamine Skin Balance Oil control 120 ml. (Pack of 2),Pirmal Healthcare,I have combination skin which means my forehead chin and top of nose region gets extremely oily and the nostril and cheek region gets extremely dry I have tried a variety of skin care products and this is the only one that can balance the oils on my face It helps heal breakouts and prevent new ones and is the only product that helps with my acne This product is also great for mild to severe sunburns apply generously to affected area and you will feel the cooling effect immediately Regular application twice thrice a day to sunburnt area helps heal the burn and peeling skin The ingredients separate easily because it is a combination of clays and glycerin so make sure you shake the bottle well before each use to ensure smooth application The product is good for years from the date at the bottom of the bottle date of manufacturing E g if the date is Aug then your bottle of the lotion is good until Aug I have been using this for years and would definitely recommend it to people with all skin types ,0.9856,Positive,0.17,0.0,0.28,0.22,0.33,Fear
14,5.0,2016-04-20,2016,Great product and fast shipment. I love it.,Lacto Calamine Skin Balance Oil control 120 ml. (Pack of 2),Pirmal Healthcare,Great product and fast shipment I love it ,0.8519,Positive,1.0,0.0,0.0,0.0,0.0,Happy
15,5.0,2012-12-22,2012,These are so great! I love how small they are. They fit in my purse and are easy to carry with my.,Mary Kay Satin Hands Hand Cream Travel MINI Size Set of 6,Mary Kay,These are so great I love how small they are They fit in my purse and are easy to carry with my ,0.9469,Positive,1.0,0.0,0.0,0.0,0.0,Happy
16,5.0,2012-07-03,2012,I read about the Mary Kay Satin Hands lotion online.  Someone gave it as a gift so I wanted to give samples of this lotion to each of the ladies that helped plan my baby shower.  I'm happy with the price and quick delivery.,Mary Kay Satin Hands Hand Cream Travel MINI Size Set of 6,Mary Kay,I read about the Mary Kay Satin Hands lotion online Someone gave it as a gift so I wanted to give samples of this lotion to each of the ladies that helped plan my baby shower I m happy with the price and quick delivery ,0.765,Positive,0.2,0.2,0.2,0.0,0.4,Fear
17,5.0,2011-05-12,2011,"Whether in travel size or full size, Mary Kay makes the best hand cream ever. It moisturizes without being greasy, and the scent doesn't conflict with your perfume, if you wear it. It is an excellent value; the quality rivals much higher priced hand creams.",Mary Kay Satin Hands Hand Cream Travel MINI Size Set of 6,Mary Kay,Whether in travel size or full size Mary Kay makes the best hand cream ever It moisturizes without being greasy and the scent doesn t conflict with your perfume if you wear it It is an excellent value the quality rivals much higher priced hand creams ,0.9563,Positive,0.33,0.0,0.0,0.67,0.0,Sad
18,3.0,2010-06-22,2010,the ad was very misleading. I thought that I would be receiving the scrub and the overnight cream. It was all hand cream and nothing else. very disappointing.,Mary Kay Satin Hands Hand Cream Travel MINI Size Set of 6,Mary Kay,the ad was very misleading I thought that I would be receiving the scrub and the overnight cream It was all hand cream and nothing else very disappointing ,0.4681,Neutral,0.0,0.0,0.5,0.5,0.0,Surprise
19,5.0,2014-03-22,2014,This moisturizer is soo awesome and smells so great.  It will work to soften the driest of hands and the small mini creams fit in small wristlets or purses to bring with you anytime.,Mary Kay Satin Hands Hand Cream Travel MINI Size Set of 6,Mary Kay,This moisturizer is soo awesome and smells so great It will work to soften the driest of hands and the small mini creams fit in small wristlets or purses to bring with you anytime ,0.916,Positive,0.33,0.0,0.17,0.17,0.33,Happy
20,1.0,2014-03-15,2014,Do not buy these. They are for Mary Kay consultants to GIVE away. They are a tax write off as well as .50 each. Go somewhere and buy a full size bottle for $10. Trust me.,Mary Kay Satin Hands Hand Cream Travel MINI Size Set of 6,Mary Kay,Do not buy these They are for Mary Kay consultants to GIVE away They are a tax write off as well as each Go somewhere and buy a full size bottle for Trust me ,0.6597,Positive,0.0,0.33,0.0,0.0,0.67,Fear
21,5.0,2014-01-02,2014,I buy these at Christmas time for the girl's stockings but keep a few for myself for traveling.  Love the lotion!,Mary Kay Satin Hands Hand Cream Travel MINI Size Set of 6,Mary Kay,I buy these at Christmas time for the girl s stockings but keep a few for myself for traveling Love the lotion ,0.7959,Positive,0.33,0.0,0.33,0.0,0.33,Happy
22,5.0,2013-09-21,2013,"I got this item as a gift loved it !!! To bad it's not avail in stores. Bought as much as I could find online. Anybody who loves scented lotion,I believe would love this!",Mary Kay Satin Hands Hand Cream Travel MINI Size Set of 6,Mary Kay,I got this item as a gift loved it To bad it s not avail in stores Bought as much as I could find online Anybody who loves scented lotion I believe would love this ,0.9241,Positive,0.75,0.0,0.0,0.0,0.25,Happy
23,5.0,2013-09-09,2013,"This a a wonderful product and it works out well for me to carry these sizes in my purse. Also, this product is great for your hands.",Mary Kay Satin Hands Hand Cream Travel MINI Size Set of 6,Mary Kay,This a a wonderful product and it works out well for me to carry these sizes in my purse Also this product is great for your hands ,0.872,Positive,0.33,0.0,0.33,0.0,0.33,Happy
24,3.0,2013-09-04,2013,"Not taking anything away from Mary Kay products which I have been using for over 30 years,I just didn't read the entire description to realize the hand lotion was peach scented.  The scent didn't agree with my allergies.  So I gave them to friends.",Mary Kay Satin Hands Hand Cream Travel MINI Size Set of 6,Mary Kay,Not taking anything away from Mary Kay products which I have been using for over years I just didn t read the entire description to realize the hand lotion was peach scented The scent didn t agree with my allergies So I gave them to friends ,0.6358,Positive,0.2,0.2,0.2,0.0,0.4,Fear
25,5.0,2013-08-04,2013,"Thanks so much for the speedy postage. =)
Mary Kay is a fabulous brand, and the packaging in small portions meant I was able to donate for a charitable cosmetics bag.",Mary Kay Satin Hands Hand Cream Travel MINI Size Set of 6,Mary Kay,Thanks so much for the speedy postage Mary Kay is a fabulous brand and the packaging in small portions meant I was able to donate for a charitable cosmetics bag ,0.9042,Positive,0.5,0.0,0.0,0.5,0.0,Happy
26,5.0,2013-07-06,2013,"It's very convenient to use and easy to take with. I use the Mary kay cosmetics has been for 6 years, I am a loyal consumers. This is the first time after I come to the United States to buy on the net, I am very happy with them.",Mary Kay Satin Hands Hand Cream Travel MINI Size Set of 6,Mary Kay,It s very convenient to use and easy to take with I use the Mary kay cosmetics has been for years I am a loyal consumers This is the first time after I come to the United States to buy on the net I am very happy with them ,0.9152,Positive,0.5,0.0,0.0,0.25,0.25,Happy
27,5.0,2013-06-10,2013,"Great these as lil gifts for a Tea party, have had it as of yet, I'm sure the ladies will love it",Mary Kay Satin Hands Hand Cream Travel MINI Size Set of 6,Mary Kay,Great these as lil gifts for a Tea party have had it as of yet I m sure the ladies will love it,0.9231,Positive,1.0,0.0,0.0,0.0,0.0,Happy
28,5.0,2013-02-26,2013,I have always loved Satin Hands.  It feels so good on my skin.  I can tell the difference immediatel after applying it to my hands.,Mary Kay Satin Hands Hand Cream Travel MINI Size Set of 6,Mary Kay,I have always loved Satin Hands It feels so good on my skin I can tell the difference immediatel after applying it to my hands ,0.8244,Positive,1.0,0.0,0.0,0.0,0.0,Happy
29,3.0,2015-10-20,2015,This was purchased as a holiday gift.,Mary Kay Satin Hands Hand Cream Travel MINI Size Set of 6,Mary Kay,This was purchased as a holiday gift ,0.6808,Positive,0.0,0.0,0.0,0.0,1.0,Fear
30,1.0,2015-07-21,2015,I KNOW THAT THIS PRODUCT IS GREAT FOR BEFORE EXPERIENCE BUT I NEVER RECEIVED THOSE.,Mary Kay Satin Hands Hand Cream Travel MINI Size Set of 6,Mary Kay,I KNOW THAT THIS PRODUCT IS GREAT FOR BEFORE EXPERIENCE BUT I NEVER RECEIVED THOSE ,0.3716,Neutral,0.5,0.0,0.5,0.0,0.0,Happy
32,4.0,2014-09-10,2014,"Loved the lotion, non greasy and absorbs nicely.",Mary Kay Satin Hands Hand Cream Travel MINI Size Set of 6,Mary Kay,Loved the lotion non greasy and absorbs nicely ,0.7783,Positive,0.5,0.0,0.5,0.0,0.0,Happy
33,5.0,2014-09-04,2014,I passed these out as thank you gifts. They all love it. It has such a fresh smell.,Mary Kay Satin Hands Hand Cream Travel MINI Size Set of 6,Mary Kay,I passed these out as thank you gifts They all love it It has such a fresh smell ,0.8402,Positive,0.5,0.0,0.0,0.0,0.5,Happy
35,2.0,2014-05-31,2014,"I bought this because Steve Harvey raved about the lotion.  I've bought dollar store lotion that works better!  Waste of $11.  If you have dry skin, this isn't for you.  I wish I had bought coconut oil or cocoa butter.  Very disappointed.",Mary Kay Satin Hands Hand Cream Travel MINI Size Set of 6,Mary Kay,I bought this because Steve Harvey raved about the lotion I ve bought dollar store lotion that works better Waste of If you have dry skin this isn t for you I wish I had bought coconut oil or cocoa butter Very disappointed ,-0.7044,Negative,0.0,0.0,0.0,0.67,0.33,Sad
36,4.0,2014-05-08,2014,Makes hands soft and subtle. Fragrance free for it would work for either male or female. Great for stocking stuffers,Mary Kay Satin Hands Hand Cream Travel MINI Size Set of 6,Mary Kay,Makes hands soft and subtle Fragrance free for it would work for either male or female Great for stocking stuffers,0.8126,Positive,0.33,0.0,0.0,0.17,0.5,Fear
37,5.0,2014-04-04,2014,Great condition and smells wonderful!! Very pleased with my buy!! I'll be using these as gifts for my Mary Kay customers :),Mary Kay Satin Hands Hand Cream Travel MINI Size Set of 6,Mary Kay,Great condition and smells wonderful Very pleased with my buy I ll be using these as gifts for my Mary Kay customers ,0.9447,Positive,0.25,0.0,0.25,0.25,0.25,Happy
38,5.0,2015-03-09,2015,it is still to this day my favorite glad you had it,Jenna Jameson Heartbreaker Perfume for women 3.4 oz Eau De Parfum Spray,Jenna Jameson,it is still to this day my favorite glad you had it,0.7184,Positive,1.0,0.0,0.0,0.0,0.0,Happy
39,5.0,2015-03-02,2015,"Love the way this perfume smells.  Such a soft, sexy scent.",Jenna Jameson Heartbreaker Perfume for women 3.4 oz Eau De Parfum Spray,Jenna Jameson,Love the way this perfume smells Such a soft sexy scent ,0.8225,Positive,0.5,0.0,0.0,0.0,0.5,Happy
40,5.0,2015-02-19,2015,love this perfume!  I get so many compliments on it!,Jenna Jameson Heartbreaker Perfume for women 3.4 oz Eau De Parfum Spray,Jenna Jameson,love this perfume I get so many compliments on it ,0.83,Positive,1.0,0.0,0.0,0.0,0.0,Happy
41,5.0,2015-01-14,2015,"This is a well done scent its slightly sweet, spicy and warm. This is definitely unisex a lot of masculine notes. I would absolutely recommend this perfume to girls and guys, but definitely unisex.",Jenna Jameson Heartbreaker Perfume for women 3.4 oz Eau De Parfum Spray,Jenna Jameson,This is a well done scent its slightly sweet spicy and warm This is definitely unisex a lot of masculine notes I would absolutely recommend this perfume to girls and guys but definitely unisex ,0.8462,Positive,0.0,0.0,0.17,0.17,0.67,Fear
42,5.0,2013-01-13,2013,The package was a complete satisfaction to my wife. Smell is great and not too strong. I would recommend it to everyone.,Jenna Jameson Heartbreaker Perfume for women 3.4 oz Eau De Parfum Spray,Jenna Jameson,The package was a complete satisfaction to my wife Smell is great and not too strong I would recommend it to everyone ,0.7781,Positive,0.75,0.0,0.0,0.0,0.25,Happy
43,5.0,2012-09-11,2012,I llove heartbraker. I started out with just the perfurm and then got everything eles. I love how it smells and the price is amazig:).,Jenna Jameson Heartbreaker Perfume for women 3.4 oz Eau De Parfum Spray,Jenna Jameson,I llove heartbraker I started out with just the perfurm and then got everything eles I love how it smells and the price is amazig ,0.6369,Positive,0.5,0.0,0.0,0.0,0.5,Happy
44,5.0,2012-04-13,2012,"I was first introduced to this scent when a friend bought it and I fell in love.  I just ordered mine (although I found it for half price on ebay) and I've been wearing it ever since.  This is a very spicy, and warm scent.  When I wear it I feel sexy and I know I smell that way too. Everyone has commented on how great it smells and my boyfriend really likes it.  I also love the bottle, It's so beautiful to look at and comes with a removeable charm with Jenna's signature on the back.  The charm is very heavy so I took it off and am using it as a key chain, which to me is a plus.  I definately recommend this product to anyone looking for a very spicy and sexy scent.",Jenna Jameson Heartbreaker Perfume for women 3.4 oz Eau De Parfum Spray,Jenna Jameson,I was first introduced to this scent when a friend bought it and I fell in love I just ordered mine although I found it for half price on ebay and I ve been wearing it ever since This is a very spicy and warm scent When I wear it I feel sexy and I know I smell that way too Everyone has commented on how great it smells and my boyfriend really likes it I also love the bottle It s so beautiful to look at and comes with a removeable charm with Jenna s signature on the back The charm is very heavy so I took it off and am using it as a key chain which to me is a plus I definately recommend this product to anyone looking for a very spicy and sexy scent ,0.991,Positive,0.5,0.07,0.07,0.14,0.21,Happy
45,2.0,2017-01-09,2017,I love Jenna ! But this just out right sucks ! It smell just like old baby powder  But I am still going to keep it because it is by Jenna,Jenna Jameson Heartbreaker Perfume for women 3.4 oz Eau De Parfum Spray,Jenna Jameson,I love Jenna But this just out right sucks It smell just like old baby powder But I am still going to keep it because it is by Jenna,0.4912,Neutral,0.5,0.0,0.0,0.0,0.5,Happy
46,4.0,2016-12-19,2016,Love this scent. The heart charm looks a little cheap. Great scent to wear in the evening.,Jenna Jameson Heartbreaker Perfume for women 3.4 oz Eau De Parfum Spray,Jenna Jameson,Love this scent The heart charm looks a little cheap Great scent to wear in the evening ,0.8939,Positive,0.75,0.0,0.0,0.25,0.0,Happy
47,5.0,2016-12-15,2016,"best stuff i ever bought
cant be bought in regular stores, porn star designed this purfume, its awesome",Jenna Jameson Heartbreaker Perfume for women 3.4 oz Eau De Parfum Spray,Jenna Jameson,best stuff i ever bought cant be bought in regular stores porn star designed this purfume its awesome,0.8519,Positive,0.0,0.25,0.75,0.0,0.0,Surprise
49,3.0,2016-11-14,2016,My current boyfriend said this perfume smell great! I said does it turn you on? He said yes. So being the good girlfriend I am I bought it. It doesn't turn heads or get compliments. The scent doesn't last and smells very much like the alcohol it is so heavily used with. Scent come out strong and fades quick. The bottle is pretty and the light lingering scent it does have doesn't smell that bad after a while. I would not purchase it again. overall the perfume is ok. You get what you pay for. It was 15 $,Jenna Jameson Heartbreaker Perfume for women 3.4 oz Eau De Parfum Spray,Jenna Jameson,My current boyfriend said this perfume smell great I said does it turn you on He said yes So being the good girlfriend I am I bought it It doesn t turn heads or get compliments The scent doesn t last and smells very much like the alcohol it is so heavily used with Scent come out strong and fades quick The bottle is pretty and the light lingering scent it does have doesn t smell that bad after a while I would not purchase it again overall the perfume is ok You get what you pay for It was ,0.9773,Positive,0.25,0.08,0.17,0.08,0.42,Fear
50,1.0,2016-08-12,2016,i adore Jenna but i thought i would love this but the smell doesnt do me any justice on my skin  ...sad face,Jenna Jameson Heartbreaker Perfume for women 3.4 oz Eau De Parfum Spray,Jenna Jameson,i adore Jenna but i thought i would love this but the smell doesnt do me any justice on my skin sad face,0.9287,Positive,0.4,0.0,0.0,0.2,0.4,Happy
51,3.0,2016-07-29,2016,"At first, this smells very fruity with some complexity to it with the patchouli. I'm not a fan of patchouli, but the initial scent from this when sprayed is actually quite beautiful!  However, that floral / fruitiness quickly goes away and the patchouli steps in to punch you square in the face like a prize fighter.  Seriously, you have to really, REALLY love patchouli to love this one. One of the positives of this is the bottle. It's really pretty to look at, as well as the dangling hearts. They are not cheap plastic as I thought it would be, but rather, they are made from metal. They're kind of heavy actually, but I think they really add to the charm of the bottle's look.

I'm glad I purchased it, because I had been really curious, but it's definitely not a favorite of mine.",Jenna Jameson Heartbreaker Perfume for women 3.4 oz Eau De Parfum Spray,Jenna Jameson,At first this smells very fruity with some complexity to it with the patchouli I m not a fan of patchouli but the initial scent from this when sprayed is actually quite beautiful However that floral fruitiness quickly goes away and the patchouli steps in to punch you square in the face like a prize fighter Seriously you have to really REALLY love patchouli to love this one One of the positives of this is the bottle It s really pretty to look at as well as the dangling hearts They are not cheap plastic as I thought it would be but rather they are made from metal They re kind of heavy actually but I think they really add to the charm of the bottle s look I m glad I purchased it because I had been really curious but it s definitely not a favorite of mine ,0.9956,Positive,0.36,0.05,0.05,0.23,0.32,Happy
53,4.0,2016-06-07,2016,I love this!!! The bottle is so cute and the scent is a very nice fruity-floral one with a bit of musk.,Jenna Jameson Heartbreaker Perfume for women 3.4 oz Eau De Parfum Spray,Jenna Jameson,I love this The bottle is so cute and the scent is a very nice fruity floral one with a bit of musk ,0.9191,Positive,1.0,0.0,0.0,0.0,0.0,Happy
54,5.0,2016-04-04,2016,now this is very good beautiful smell and i just love it,Jenna Jameson Heartbreaker Perfume for women 3.4 oz Eau De Parfum Spray,Jenna Jameson,now this is very good beautiful smell and i just love it,0.9113,Positive,0.67,0.0,0.0,0.0,0.33,Happy
55,5.0,2016-02-07,2016,"I knew that I loved it, that's why I bought it. Wonderful scent, excellent quality.",Jenna Jameson Heartbreaker Perfume for women 3.4 oz Eau De Parfum Spray,Jenna Jameson,I knew that I loved it that s why I bought it Wonderful scent excellent quality ,0.9062,Positive,0.67,0.0,0.33,0.0,0.0,Happy
56,1.0,2015-11-19,2015,"Maybe I got a bad bottle or something, but this perfume did not smell good. Very harsh smell, like you could almost smell chemicals mixed in with the flower and cheap soap scent. I was really surprised because I expected this to be awesome being from Jenna Jameson! Then, I read that this perfume hasn't been made in YEARS so this is very likely old stock where age has changed the scent dramatically.",Jenna Jameson Heartbreaker Perfume for women 3.4 oz Eau De Parfum Spray,Jenna Jameson,Maybe I got a bad bottle or something but this perfume did not smell good Very harsh smell like you could almost smell chemicals mixed in with the flower and cheap soap scent I was really surprised because I expected this to be awesome being from Jenna Jameson Then I read that this perfume hasn t been made in YEARS so this is very likely old stock where age has changed the scent dramatically ,0.5759,Positive,0.1,0.1,0.2,0.2,0.4,Fear
