index,overall,Date,Year,reviewText,title,brand,Cleaned Reviews,Vader Sentiment,Vader Analysis,Happy,Angry,Surprise,Sad,Fear,emotion
30903,5.0,2015-02-08,2015,"Very good blades, especially for the price.  Comfortable to use and are a nice balance between a sharp blade and one that will forgive a new wet-shaver's mistakes.  As high quality as anything else that's made in Germany.  I've since switched to Feather blades because they're sharper, but these are my second favorite.",Wilkinson Sword Double Edge Razor Blade Refills for Men - 5 Count,Schick,Very good blades especially for the price Comfortable to use and are a nice balance between a sharp blade and one that will forgive a new wet shaver s mistakes As high quality as anything else that s made in Germany I ve since switched to Feather blades because they re sharper but these are my second favorite ,0.8379,Positive,0.43,0.14,0.0,0.14,0.29,Happy
30904,5.0,2015-02-05,2015,"Best blades out there.  Still one my first blade.  I got 20 great shaves from one side, and now I am using the other edge.  I bought 100 blades, enough to last me about 8 years of shaving every day.",Wilkinson Sword Double Edge Razor Blade Refills for Men - 5 Count,Schick,Best blades out there Still one my first blade I got great shaves from one side and now I am using the other edge I bought blades enough to last me about years of shaving every day ,0.8519,Positive,0.67,0.0,0.0,0.33,0.0,Happy
30905,2.0,2015-02-03,2015,"These blades are NOT stainless steel as some have reported. They are chromium, ceramic coated and PFTE(?). I wanted to try a double edge razor to see what all the hub bub was about.  I tried the blades that came with (stainless) and these. I didn't like the shave with either. I will go back to my Trac II type, non-pivoting, heavier handle. I get a great shave with a trac II handle aka 'bump fighter razor' - rubberized non-pivoting black with a nice weight and balance. I remember when Trac II came out. SNL was new and did a spoof commercial saying ""Trac 3 because you'll believe anything"". Now we're up to 5 and 6 blades in a cartridge. Personna sells Trac II stainless blades here in bulk at great prices.",Wilkinson Sword Double Edge Razor Blade Refills for Men - 5 Count,Schick,These blades are NOT stainless steel as some have reported They are chromium ceramic coated and PFTE I wanted to try a double edge razor to see what all the hub bub was about I tried the blades that came with stainless and these I didn t like the shave with either I will go back to my Trac II type non pivoting heavier handle I get a great shave with a trac II handle aka bump fighter razor rubberized non pivoting black with a nice weight and balance I remember when Trac II came out SNL was new and did a spoof commercial saying Trac because you ll believe anything Now we re up to and blades in a cartridge Personna sells Trac II stainless blades here in bulk at great prices ,0.8883,Positive,0.38,0.0,0.12,0.25,0.25,Happy
30906,4.0,2015-01-29,2015,used double edge blades before.  wilkinson sword blades are best.,Wilkinson Sword Double Edge Razor Blade Refills for Men - 5 Count,Schick,used double edge blades before wilkinson sword blades are best ,0.6369,Positive,0.0,0.0,0.0,1.0,0.0,Sad
30909,5.0,2015-01-28,2015,"Favorite DE blades next to Personna blades.
From my experience, seem to be a 7.5/10 in the ""sharpness scale"", with 1 being weird generic blades, and 10 being Feathers.
Maintain a nice edge, and need to be replaced every 3-5 shaves, depending on skin sensitivity and beard coarseness.",Wilkinson Sword Double Edge Razor Blade Refills for Men - 5 Count,Schick,Favorite DE blades next to Personna blades From my experience seem to be a in the sharpness scale with being weird generic blades and being Feathers Maintain a nice edge and need to be replaced every shaves depending on skin sensitivity and beard coarseness ,0.6249,Positive,0.25,0.25,0.12,0.25,0.12,Happy
30910,5.0,2015-01-26,2015,Really like these.  The sharpness is just about right for me.,Wilkinson Sword Double Edge Razor Blade Refills for Men - 5 Count,Schick,Really like these The sharpness is just about right for me ,0.4201,Neutral,0.0,1.0,0.0,0.0,0.0,Angry
30911,5.0,2015-01-24,2015,Just buys these!  the best of the best !!,Wilkinson Sword Double Edge Razor Blade Refills for Men - 5 Count,Schick,Just buys these the best of the best ,0.8827,Positive,0.0,0.0,0.0,0.0,0.0,Happy
30912,3.0,2015-01-24,2015,"I've gotta say for such a popular blade with such high reviews, I just wasn't that impressed. Don't get me wrong, this is a good middle of the road blade. But I've gone through two of those large ""variety"" packs with about 15 diff blades in each and this blade just didn't knock my socks off.

It gave me a good shave, again im not saying this is a bad blade. But for me it just didn't live up to all the rave reviews I've read. It's a 3/5 blade, good, but won't be buying these in packs. Too many other better blades out there.",Wilkinson Sword Double Edge Razor Blade Refills for Men - 5 Count,Schick,I ve gotta say for such a popular blade with such high reviews I just wasn t that impressed Don t get me wrong this is a good middle of the road blade But I ve gone through two of those large variety packs with about diff blades in each and this blade just didn t knock my socks off It gave me a good shave again im not saying this is a bad blade But for me it just didn t live up to all the rave reviews I ve read It s a blade good but won t be buying these in packs Too many other better blades out there ,0.8641,Positive,0.2,0.0,0.0,0.4,0.4,Sad
30913,4.0,2015-01-23,2015,"Sharp, get about 4 cuts before it starts to nick you up.  Solid razors.",Wilkinson Sword Double Edge Razor Blade Refills for Men - 5 Count,Schick,Sharp get about cuts before it starts to nick you up Solid razors ,-0.1531,Neutral,0.0,1.0,0.0,0.0,0.0,Angry
30914,4.0,2015-01-23,2015,"In my top 3 of DE razors, behind Astra and Feather",Wilkinson Sword Double Edge Razor Blade Refills for Men - 5 Count,Schick,In my top of DE razors behind Astra and Feather,0.2023,Neutral,0.0,0.0,1.0,0.0,0.0,Surprise
30915,5.0,2015-01-22,2015,"Went to my local ""all in one store"" and bought the only Double Edge (generic) blades for sale.  Felt like I was scraping my face with a dull rock.  Fortunately, the store gave me my $$ back.  I bought these Wilkinson razor blades on Amazon.  Wow!  What a difference.  Free shipping too.",Wilkinson Sword Double Edge Razor Blade Refills for Men - 5 Count,Schick,Went to my local all in one store and bought the only Double Edge generic blades for sale Felt like I was scraping my face with a dull rock Fortunately the store gave me my back I bought these Wilkinson razor blades on Amazon Wow What a difference Free shipping too ,0.8356,Positive,0.29,0.0,0.14,0.43,0.14,Sad
30917,2.0,2015-01-18,2015,"I was under the impression these were pre-scored...maybe they are and I am missing something, but whenever I try to snap them in half for use with my shavette, they bend. This makes them difficult to insert into my shaving apparatus.",Wilkinson Sword Double Edge Razor Blade Refills for Men - 5 Count,Schick,I was under the impression these were pre scored maybe they are and I am missing something but whenever I try to snap them in half for use with my shavette they bend This makes them difficult to insert into my shaving apparatus ,-0.5267,Negative,0.0,0.33,0.17,0.33,0.17,Angry
30918,5.0,2015-01-18,2015,Great quick arrival will get plenty of use out of these,Wilkinson Sword Double Edge Razor Blade Refills for Men - 5 Count,Schick,Great quick arrival will get plenty of use out of these,0.6249,Positive,0.33,0.33,0.0,0.0,0.33,Happy
30919,2.0,2015-01-15,2015,I have extremely coarse stubble and these blades feel like they are dull before I'm finished with a single use.  The price is ok if you have finer/softer hair.,Wilkinson Sword Double Edge Razor Blade Refills for Men - 5 Count,Schick,I have extremely coarse stubble and these blades feel like they are dull before I m finished with a single use The price is ok if you have finer softer hair ,0.25,Neutral,0.0,0.0,0.5,0.5,0.0,Surprise
30920,5.0,2015-01-15,2015,WORK GREAT CAME FAST,Wilkinson Sword Double Edge Razor Blade Refills for Men - 5 Count,Schick,WORK GREAT CAME FAST,0.6249,Positive,0.5,0.0,0.0,0.0,0.5,Happy
30923,5.0,2015-01-14,2015,"Very good blades, better than the 200 Derby blades that recently purchased.",Wilkinson Sword Double Edge Razor Blade Refills for Men - 5 Count,Schick,Very good blades better than the Derby blades that recently purchased ,0.7474,Positive,0.0,0.0,0.0,0.0,1.0,Fear
30924,1.0,2015-01-12,2015,"cut myself badly, maybe too flexible",Wilkinson Sword Double Edge Razor Blade Refills for Men - 5 Count,Schick,cut myself badly maybe too flexible,-0.5106,Negative,0.0,0.0,0.0,1.0,0.0,Sad
30925,5.0,2015-01-12,2015,"I switch between these and the Feather brand occasionally just to switch things up.  Either way, I follow up with my Fusion, ATG, to get my face BBS.

My grandfather also loves them, so I gave him some for his birthday in August and then again for Xmas.",Wilkinson Sword Double Edge Razor Blade Refills for Men - 5 Count,Schick,I switch between these and the Feather brand occasionally just to switch things up Either way I follow up with my Fusion ATG to get my face BBS My grandfather also loves them so I gave him some for his birthday in August and then again for Xmas ,0.5719,Positive,0.17,0.0,0.17,0.17,0.5,Fear
30928,2.0,2015-01-08,2015,"I guess these blades are sharp enough for novice shavers and deemed safer. But anyone who has graduated Shaving 101 and knows his way around a double-edge razor, probably won't be satisfied.  Sure, you can get a clean shave with these, if you drag your razor repeatedly over the same area. But with a sharper blade (the Feather Hi-Stainless Platinum is my choice), it becomes a one-pass operation. Just take your time and use proper shaving technique. For me, the Feathers are definitely worth their slightly higher cost.",Wilkinson Sword Double Edge Razor Blade Refills for Men - 5 Count,Schick,I guess these blades are sharp enough for novice shavers and deemed safer But anyone who has graduated Shaving and knows his way around a double edge razor probably won t be satisfied Sure you can get a clean shave with these if you drag your razor repeatedly over the same area But with a sharper blade the Feather Hi Stainless Platinum is my choice it becomes a one pass operation Just take your time and use proper shaving technique For me the Feathers are definitely worth their slightly higher cost ,0.5513,Positive,0.1,0.2,0.2,0.1,0.4,Fear
30929,3.0,2015-01-04,2015,"just seems ok. blades are subjective but for me, I seem to get a better shave with the astra's or derby's. so far, sticking with astras as they work well and inexpensive.",Wilkinson Sword Double Edge Razor Blade Refills for Men - 5 Count,Schick,just seems ok blades are subjective but for me I seem to get a better shave with the astra s or derby s so far sticking with astras as they work well and inexpensive ,0.7964,Positive,0.0,0.0,0.0,0.0,1.0,Fear
30930,4.0,2015-01-04,2015,"A good blade for a quick shave and those new to the world of wet shaving; sharp without being too hash, forgiving without being too dull. Depending on your beard and technique, it might take a few extra passes to achieve baby smooth skin.",Wilkinson Sword Double Edge Razor Blade Refills for Men - 5 Count,Schick,A good blade for a quick shave and those new to the world of wet shaving sharp without being too hash forgiving without being too dull Depending on your beard and technique it might take a few extra passes to achieve baby smooth skin ,0.794,Positive,0.0,0.6,0.0,0.2,0.2,Angry
30931,5.0,2015-01-03,2015,"I have coarse, relatively flat beard hairs and fairly sensitive skin. These are the blades I have found best for my hair and skin. More aggressive blades (like Feather) seem to cut slightly smoother on the first or second use, but don't last for more shaves than the Wilkinson Sword classics, so don't warrant the higher price in my opinion. Less aggressive blades like Derby don't last as long for me, and irritate the skin more due to cutting slightly less smoothly.",Wilkinson Sword Double Edge Razor Blade Refills for Men - 5 Count,Schick,I have coarse relatively flat beard hairs and fairly sensitive skin These are the blades I have found best for my hair and skin More aggressive blades like Feather seem to cut slightly smoother on the first or second use but don t last for more shaves than the Wilkinson Sword classics so don t warrant the higher price in my opinion Less aggressive blades like Derby don t last as long for me and irritate the skin more due to cutting slightly less smoothly ,-0.5757,Negative,0.0,0.33,0.33,0.17,0.17,Angry
30933,5.0,2014-12-28,2014,"Great price on authentic blades, work just as I remember from 45 years ago.",Wilkinson Sword Double Edge Razor Blade Refills for Men - 5 Count,Schick,Great price on authentic blades work just as I remember from years ago ,0.6249,Positive,0.5,0.0,0.0,0.0,0.5,Happy
30934,4.0,2014-12-27,2014,"These blades are just as the product review I've read say; not exceptionally sharp compared to the 'sharpest' of the bunch rated brands, but nice and forgiving for the less than expert double-edge shaver.  They are plenty sharp to deliver a close shave.",Wilkinson Sword Double Edge Razor Blade Refills for Men - 5 Count,Schick,These blades are just as the product review I ve read say not exceptionally sharp compared to the sharpest of the bunch rated brands but nice and forgiving for the less than expert double edge shaver They are plenty sharp to deliver a close shave ,0.8201,Positive,0.33,0.33,0.0,0.33,0.0,Happy
30935,5.0,2014-12-27,2014,"These work awesome, and a great bang for the buck!",Wilkinson Sword Double Edge Razor Blade Refills for Men - 5 Count,Schick,These work awesome and a great bang for the buck ,0.8588,Positive,0.33,0.0,0.33,0.0,0.33,Happy
30936,4.0,2014-12-22,2014,A great blade. Was using Derby blades originally and wanted to try another brand. These gave a much better shave than the Derby.,Wilkinson Sword Double Edge Razor Blade Refills for Men - 5 Count,Schick,A great blade Was using Derby blades originally and wanted to try another brand These gave a much better shave than the Derby ,0.7906,Positive,0.33,0.0,0.0,0.33,0.33,Happy
30937,2.0,2014-12-21,2014,"Tried many brands, definitely not my favorite.",Wilkinson Sword Double Edge Razor Blade Refills for Men - 5 Count,Schick,Tried many brands definitely not my favorite ,0.0567,Neutral,0.33,0.0,0.0,0.33,0.33,Happy
30938,5.0,2014-12-20,2014,Can't beat a shave with anew blade. These a prices so you can change them often.,Wilkinson Sword Double Edge Razor Blade Refills for Men - 5 Count,Schick,Can t beat a shave with anew blade These a prices so you can change them often ,0.0,Neutral,0.0,0.0,1.0,0.0,0.0,Surprise
30939,5.0,2014-12-17,2014,exellent Good product,Wilkinson Sword Double Edge Razor Blade Refills for Men - 5 Count,Schick,exellent Good product,0.4404,Neutral,0.0,0.0,0.0,0.0,0.0,Happy
30940,5.0,2014-12-15,2014,"My favorite glad this far. Sharp and smooth. Have a coarse beard and have used red personna, derby, shark, Astra and blue bird",Wilkinson Sword Double Edge Razor Blade Refills for Men - 5 Count,Schick,My favorite glad this far Sharp and smooth Have a coarse beard and have used red personna derby shark Astra and blue bird,0.7184,Positive,0.29,0.57,0.0,0.14,0.0,Angry
30942,5.0,2014-12-09,2014,"Sharp, long lasting blades.  Very little irritation.  Remain sharp through repeated shaves and appear to be better than your average drug or discount store house brands.  When you are done shaving, rinse them thoroughly under hot running water and they will last.",Wilkinson Sword Double Edge Razor Blade Refills for Men - 5 Count,Schick,Sharp long lasting blades Very little irritation Remain sharp through repeated shaves and appear to be better than your average drug or discount store house brands When you are done shaving rinse them thoroughly under hot running water and they will last ,-0.099,Neutral,0.0,0.25,0.0,0.38,0.38,Sad
30943,5.0,2014-12-08,2014,As described. These blades are awesome.,Wilkinson Sword Double Edge Razor Blade Refills for Men - 5 Count,Schick,As described These blades are awesome ,0.6249,Positive,0.0,0.0,1.0,0.0,0.0,Surprise
30944,5.0,2014-12-07,2014,"Great blades for the wet shaver. I have a coarse beard and this blade does a nice job of beard removal. You need to make several passes but after you are done, you have a great shave.",Wilkinson Sword Double Edge Razor Blade Refills for Men - 5 Count,Schick,Great blades for the wet shaver I have a coarse beard and this blade does a nice job of beard removal You need to make several passes but after you are done you have a great shave ,0.8779,Positive,0.43,0.29,0.0,0.14,0.14,Happy
30945,3.0,2014-12-06,2014,ok blade,Wilkinson Sword Double Edge Razor Blade Refills for Men - 5 Count,Schick,ok blade,0.296,Neutral,0.0,0.0,0.0,0.0,0.0,Happy
30946,2.0,2014-11-29,2014,A waste of money. Feather blades give a closer shave with no irritation.,Wilkinson Sword Double Edge Razor Blade Refills for Men - 5 Count,Schick,A waste of money Feather blades give a closer shave with no irritation ,-0.8074,Negative,0.0,0.0,0.0,0.0,1.0,Fear
30948,5.0,2014-11-23,2014,Great price! Sharp!,Wilkinson Sword Double Edge Razor Blade Refills for Men - 5 Count,Schick,Great price Sharp ,0.6892,Positive,0.5,0.5,0.0,0.0,0.0,Happy
30949,5.0,2014-11-22,2014,I like it very much and much cheaper than the stores.,Wilkinson Sword Double Edge Razor Blade Refills for Men - 5 Count,Schick,I like it very much and much cheaper than the stores ,0.3612,Neutral,0.0,0.0,0.0,0.0,0.0,Happy
30950,5.0,2014-11-19,2014,the order was as described.  Quick delivery.  Thank you!,Wilkinson Sword Double Edge Razor Blade Refills for Men - 5 Count,Schick,the order was as described Quick delivery Thank you ,0.4199,Neutral,0.0,1.0,0.0,0.0,0.0,Angry
30951,5.0,2014-11-19,2014,First time user of Wilkinson brand. Smooth shave. Used with Muhle R89 Grande.,Wilkinson Sword Double Edge Razor Blade Refills for Men - 5 Count,Schick,First time user of Wilkinson brand Smooth shave Used with Muhle R Grande ,0.0,Neutral,0.0,0.0,0.0,1.0,0.0,Sad
30953,5.0,2014-11-17,2014,"I'm a double edge newbie and so far I've tried 3 different brands of blades... the Astra Superior Platinums are my favorite, followed closely by the Wilkinson Sword Classics. The Persona Israeli Crystal Super Plus Platinums tug on my whiskers and give me razor burn and I don't like them at all.",Wilkinson Sword Double Edge Razor Blade Refills for Men - 5 Count,Schick,I m a double edge newbie and so far I ve tried different brands of blades the Astra Superior Platinums are my favorite followed closely by the Wilkinson Sword Classics The Persona Israeli Crystal Super Plus Platinums tug on my whiskers and give me razor burn and I don t like them at all ,0.8515,Positive,0.2,0.0,0.0,0.6,0.2,Sad
30954,5.0,2014-11-14,2014,"Wow! These are amazing! Perfect for all areas, and I haven't nicked myself even though Im a rank beginner.

 I ordered these after trying the Derby blades that came with my razor seemed to drag on my tougher armpit and sensitive area hairs. They were shipped by overstockdrugstore and came in 4 days. I was thrilled. They cut smooth as glass even going against the grain. Definitely will purchase again.",Wilkinson Sword Double Edge Razor Blade Refills for Men - 5 Count,Schick,Wow These are amazing Perfect for all areas and I haven t nicked myself even though Im a rank beginner I ordered these after trying the Derby blades that came with my razor seemed to drag on my tougher armpit and sensitive area hairs They were shipped by overstockdrugstore and came in days I was thrilled They cut smooth as glass even going against the grain Definitely will purchase again ,0.9449,Positive,0.12,0.0,0.5,0.12,0.25,Surprise
30955,5.0,2014-11-13,2014,Buy it it's still an excellent blade.,Wilkinson Sword Double Edge Razor Blade Refills for Men - 5 Count,Schick,Buy it it s still an excellent blade ,0.5719,Positive,1.0,0.0,0.0,0.0,0.0,Happy
30956,2.0,2014-11-13,2014,"These really disappointed me... I read that they were a great, smoother alternative to Feather blades, but I got a lot more cuts than with any other blade I've tried - weepers too, not just nicks. They are sharp but also seem to be rather hard, unforgiving blades. If you have perfect skin with very few bumps or blemishes, they might be for you.",Wilkinson Sword Double Edge Razor Blade Refills for Men - 5 Count,Schick,These really disappointed me I read that they were a great smoother alternative to Feather blades but I got a lot more cuts than with any other blade I ve tried weepers too not just nicks They are sharp but also seem to be rather hard unforgiving blades If you have perfect skin with very few bumps or blemishes they might be for you ,-0.0222,Neutral,0.12,0.25,0.12,0.5,0.0,Sad
30957,5.0,2014-11-12,2014,"These stay sharp for multiple shaves, and close shaves at that. The dispenser has a compartment for used blades - which is a nice addition. If you are looking for an affordable quality blade for your DE safety razor - give these a try.",Wilkinson Sword Double Edge Razor Blade Refills for Men - 5 Count,Schick,These stay sharp for multiple shaves and close shaves at that The dispenser has a compartment for used blades which is a nice addition If you are looking for an affordable quality blade for your DE safety razor give these a try ,0.6808,Positive,0.29,0.29,0.0,0.0,0.43,Fear
30958,3.0,2014-11-10,2014,"These are decent blades but a little too dull for my taste. I get a better shave with feather blades.

It's worth a try and maybe better suited in a slant or adjustable.",Wilkinson Sword Double Edge Razor Blade Refills for Men - 5 Count,Schick,These are decent blades but a little too dull for my taste I get a better shave with feather blades It s worth a try and maybe better suited in a slant or adjustable ,0.7856,Positive,0.25,0.0,0.25,0.25,0.25,Happy
30959,3.0,2014-11-04,2014,Feather Blades are far superior.,Wilkinson Sword Double Edge Razor Blade Refills for Men - 5 Count,Schick,Feather Blades are far superior ,0.5423,Positive,0.0,0.0,0.0,0.0,0.0,Happy
30960,5.0,2014-11-03,2014,"Great blades at a great price!
Bought these for a cheap Chinese made razor I ordered partly for the nostalgia of using a double edge and to have an inexpensive backup razor. Talk about a close shave! Way closer shave than the 5 blade system I've been using!
Like the commercial for one of those as seen on TV razors says ""you only need one blade"". I'm giving serious thought to going back to using this type of blade for everyday use as the cost of refill cartages is outrageous, at times it seems cheaper to just replace the whole razor. I'm thinking using these blades will be a major money saver over the long run.",Wilkinson Sword Double Edge Razor Blade Refills for Men - 5 Count,Schick,Great blades at a great price Bought these for a cheap Chinese made razor I ordered partly for the nostalgia of using a double edge and to have an inexpensive backup razor Talk about a close shave Way closer shave than the blade system I ve been using Like the commercial for one of those as seen on TV razors says you only need one blade I m giving serious thought to going back to using this type of blade for everyday use as the cost of refill cartages is outrageous at times it seems cheaper to just replace the whole razor I m thinking using these blades will be a major money saver over the long run ,0.8928,Positive,0.25,0.0,0.17,0.17,0.42,Fear
30961,5.0,2014-11-03,2014,A good price for the product.,Wilkinson Sword Double Edge Razor Blade Refills for Men - 5 Count,Schick,A good price for the product ,0.4404,Neutral,0.0,0.0,0.0,0.0,0.0,Happy
30962,5.0,2014-10-28,2014,Nice and clean shave,Wilkinson Sword Double Edge Razor Blade Refills for Men - 5 Count,Schick,Nice and clean shave,0.6705,Positive,1.0,0.0,0.0,0.0,0.0,Happy
30964,1.0,2014-10-26,2014,"Bought a single 5 blade sample pack to try out.  All five blades had some brown stains on them.  Looked like rust or some kind of dirt.  So I could not use them.  Since I had unwrapped and discarded each dirty blade, and it was only $ 1.49, I didn't return them.

Update:  1-star for the rusty blades.  5-stars for Amazon customer service who refunded my $1.49 + tax despite the fact that I didn't return the blades.",Wilkinson Sword Double Edge Razor Blade Refills for Men - 5 Count,Schick,Bought a single blade sample pack to try out All five blades had some brown stains on them Looked like rust or some kind of dirt So I could not use them Since I had unwrapped and discarded each dirty blade and it was only I didn t return them Update star for the rusty blades stars for Amazon customer service who refunded my tax despite the fact that I didn t return the blades ,-0.5849,Negative,0.25,0.5,0.0,0.25,0.0,Angry
30965,5.0,2014-10-26,2014,Great ! as promised !,Wilkinson Sword Double Edge Razor Blade Refills for Men - 5 Count,Schick,Great as promised ,0.8011,Positive,0.5,0.0,0.0,0.5,0.0,Happy
30966,5.0,2014-10-26,2014,Best blades on the market!,Wilkinson Sword Double Edge Razor Blade Refills for Men - 5 Count,Schick,Best blades on the market ,0.6696,Positive,0.0,0.0,0.0,0.0,1.0,Fear
30967,5.0,2014-10-24,2014,"Buy these instead of s***ty multiblade razor cartridges. Great quality, lasts long.",Wilkinson Sword Double Edge Razor Blade Refills for Men - 5 Count,Schick,Buy these instead of s ty multiblade razor cartridges Great quality lasts long ,0.6249,Positive,0.33,0.0,0.0,0.0,0.67,Fear
